question,dataset_id,columns,query
What are the three most common incident descriptions?,011_SF,"Incident Datetime; object, Incident Date; datetime64[us, UTC], Incident Time; category, Incident Year; uint16, Incident Day of Week; category, Report Datetime; object, Row ID; int64, Incident ID; uint32, Incident Number; uint32, CAD Number; float64, Report Type Code; category, Report Type Description; category, Filed Online; object, Incident Code; uint32, Incident Category; category, Incident Subcategory; category, Incident Description; category, Resolution; category, Intersection; category, CNN; float64, Police District; category, Analysis Neighborhood; category, Supervisor District; float64, Supervisor District 2012; float64, Latitude; float64, Longitude; float64, Point; category, Neighborhoods; float64, ESNCAG - Boundary File; float64, Central Market/Tenderloin Boundary Polygon - Updated; float64, Civic Center Harm Reduction Project Boundary; float64, HSOC Zones as of 2018-06-05; float64, Invest In Neighborhoods (IIN) Areas; category, Current Supervisor Districts; float64, Current Police Districts; float64",FALSE
Which 3 incident years have the lowest number of online filed reports? If two have the same number choose the latest year,011_SF,"Incident Datetime; object, Incident Date; datetime64[us, UTC], Incident Time; category, Incident Year; uint16, Incident Day of Week; category, Report Datetime; object, Row ID; int64, Incident ID; uint32, Incident Number; uint32, CAD Number; float64, Report Type Code; category, Report Type Description; category, Filed Online; object, Incident Code; uint32, Incident Category; category, Incident Subcategory; category, Incident Description; category, Resolution; category, Intersection; category, CNN; float64, Police District; category, Analysis Neighborhood; category, Supervisor District; float64, Supervisor District 2012; float64, Latitude; float64, Longitude; float64, Point; category, Neighborhoods; float64, ESNCAG - Boundary File; float64, Central Market/Tenderloin Boundary Polygon - Updated; float64, Civic Center Harm Reduction Project Boundary; float64, HSOC Zones as of 2018-06-05; float64, Invest In Neighborhoods (IIN) Areas; category, Current Supervisor Districts; float64, Current Police Districts; float64",Error: Cannot mask with non-boolean array containing NA / NaN values
What are the 4 most common chest pain types among male patients?,012_Heart,"Age; uint8, Sex; category, ChestPainType; category, RestingBP; uint8, Cholesterol; uint16, FastingBS; uint8, RestingECG; category, MaxHR; uint8, ExerciseAngina; category, Oldpeak; float64, ST_Slope; category, HeartDisease; uint8",FALSE
Did the oldest roller coaster in the dataset still operate?,013_Roller,"coaster_name; category, Length; category, Speed; object, Location; category, Status; category, Opening date; category, Type; category, Manufacturer; category, Height restriction; category, Model; category, Height; category, Inversions; float64, Lift/launch system; category, Cost; category, Trains; object, Park section; category, Duration; category, Capacity; object, G-force; category, Designer; category, Max vertical angle; category, Drop; category, Soft opening date; category, Fast Lane available; category, Replaced; category, Track layout; category, Fastrack available; category, Soft opening date.1; category, Closing date; category, Opened; category, Replaced by; category, Website; category, Flash Pass Available; category, Must transfer from wheelchair; category, Theme; category, Single rider line available; category, Restraint Style; category, Flash Pass available; category, Acceleration; object, Restraints; category, Name; category, year_introduced; uint16, latitude; float64, longitude; float64, Type_Main; category, opening_date_clean; datetime64[us, UTC], speed1; category, speed2; category, speed1_value; float64, speed1_unit; category, speed_mph; float64, height_value; float64, height_unit; category, height_ft; float64, Inversions_clean; uint8, Gforce_clean; float64",FALSE
What type of the roller coaster is the oldest in the dataset?,013_Roller,"coaster_name; category, Length; category, Speed; object, Location; category, Status; category, Opening date; category, Type; category, Manufacturer; category, Height restriction; category, Model; category, Height; category, Inversions; float64, Lift/launch system; category, Cost; category, Trains; object, Park section; category, Duration; category, Capacity; object, G-force; category, Designer; category, Max vertical angle; category, Drop; category, Soft opening date; category, Fast Lane available; category, Replaced; category, Track layout; category, Fastrack available; category, Soft opening date.1; category, Closing date; category, Opened; category, Replaced by; category, Website; category, Flash Pass Available; category, Must transfer from wheelchair; category, Theme; category, Single rider line available; category, Restraint Style; category, Flash Pass available; category, Acceleration; object, Restraints; category, Name; category, year_introduced; uint16, latitude; float64, longitude; float64, Type_Main; category, opening_date_clean; datetime64[us, UTC], speed1; category, speed2; category, speed1_value; float64, speed1_unit; category, speed_mph; float64, height_value; float64, height_unit; category, height_ft; float64, Inversions_clean; uint8, Gforce_clean; float64",Error: '<' not supported between instances of 'float' and 'str'
Name the 4 oldest roller coasters in the dataset.,013_Roller,"coaster_name; category, Length; category, Speed; object, Location; category, Status; category, Opening date; category, Type; category, Manufacturer; category, Height restriction; category, Model; category, Height; category, Inversions; float64, Lift/launch system; category, Cost; category, Trains; object, Park section; category, Duration; category, Capacity; object, G-force; category, Designer; category, Max vertical angle; category, Drop; category, Soft opening date; category, Fast Lane available; category, Replaced; category, Track layout; category, Fastrack available; category, Soft opening date.1; category, Closing date; category, Opened; category, Replaced by; category, Website; category, Flash Pass Available; category, Must transfer from wheelchair; category, Theme; category, Single rider line available; category, Restraint Style; category, Flash Pass available; category, Acceleration; object, Restraints; category, Name; category, year_introduced; uint16, latitude; float64, longitude; float64, Type_Main; category, opening_date_clean; datetime64[us, UTC], speed1; category, speed2; category, speed1_value; float64, speed1_unit; category, speed_mph; float64, height_value; float64, height_unit; category, height_ft; float64, Inversions_clean; uint8, Gforce_clean; float64",FALSE
Name the introduction years of the 6 oldest roller coasters in the dataset.,013_Roller,"coaster_name; category, Length; category, Speed; object, Location; category, Status; category, Opening date; category, Type; category, Manufacturer; category, Height restriction; category, Model; category, Height; category, Inversions; float64, Lift/launch system; category, Cost; category, Trains; object, Park section; category, Duration; category, Capacity; object, G-force; category, Designer; category, Max vertical angle; category, Drop; category, Soft opening date; category, Fast Lane available; category, Replaced; category, Track layout; category, Fastrack available; category, Soft opening date.1; category, Closing date; category, Opened; category, Replaced by; category, Website; category, Flash Pass Available; category, Must transfer from wheelchair; category, Theme; category, Single rider line available; category, Restraint Style; category, Flash Pass available; category, Acceleration; object, Restraints; category, Name; category, year_introduced; uint16, latitude; float64, longitude; float64, Type_Main; category, opening_date_clean; datetime64[us, UTC], speed1; category, speed2; category, speed1_value; float64, speed1_unit; category, speed_mph; float64, height_value; float64, height_unit; category, height_ft; float64, Inversions_clean; uint8, Gforce_clean; float64",FALSE
What type of room is the most expensive property?,014_Airbnb,"id; int64, listing_url; category, scrape_id; int64, last_scraped; datetime64[us, UTC], source; category, name; object, description; object, neighborhood_overview; object, picture_url; category, host_id; uint32, host_url; category, host_name; category, host_since; datetime64[us, UTC], host_location; category, host_about; object, host_response_time; category, host_response_rate; category, host_acceptance_rate; category, host_is_superhost; category, host_thumbnail_url; category, host_picture_url; category, host_neighbourhood; category, host_listings_count; float64, host_total_listings_count; float64, host_verifications; object, host_has_profile_pic; category, host_identity_verified; category, neighbourhood; category, neighbourhood_cleansed; category, neighbourhood_group_cleansed; category, latitude; float64, longitude; float64, property_type; category, room_type; category, accommodates; uint8, bathrooms; category, bathrooms_text; category, bedrooms; float64, beds; float64, amenities; object, price; category, minimum_nights; uint16, maximum_nights; uint32, minimum_minimum_nights; float64, maximum_minimum_nights; float64, minimum_maximum_nights; float64, maximum_maximum_nights; float64, minimum_nights_avg_ntm; float64, maximum_nights_avg_ntm; float64, calendar_updated; category, has_availability; category, availability_30; uint8, availability_60; uint8, availability_90; uint8, availability_365; uint16, calendar_last_scraped; datetime64[us, UTC], number_of_reviews; uint16, number_of_reviews_ltm; uint16, number_of_reviews_l30d; uint8, first_review; datetime64[us, UTC], last_review; datetime64[us, UTC], review_scores_rating; float64, review_scores_accuracy; float64, review_scores_cleanliness; float64, review_scores_checkin; float64, review_scores_communication; float64, review_scores_location; float64, review_scores_value; float64, license; category, instant_bookable; category, calculated_host_listings_count; uint8, calculated_host_listings_count_entire_homes; uint8, calculated_host_listings_count_private_rooms; uint8, calculated_host_listings_count_shared_rooms; uint8, reviews_per_month; float64",Error: could not convert string to float: '$90.00'
What is the acceptance rate of the host of the property that can accommodate the most number of guests?,014_Airbnb,"id; int64, listing_url; category, scrape_id; int64, last_scraped; datetime64[us, UTC], source; category, name; object, description; object, neighborhood_overview; object, picture_url; category, host_id; uint32, host_url; category, host_name; category, host_since; datetime64[us, UTC], host_location; category, host_about; object, host_response_time; category, host_response_rate; category, host_acceptance_rate; category, host_is_superhost; category, host_thumbnail_url; category, host_picture_url; category, host_neighbourhood; category, host_listings_count; float64, host_total_listings_count; float64, host_verifications; object, host_has_profile_pic; category, host_identity_verified; category, neighbourhood; category, neighbourhood_cleansed; category, neighbourhood_group_cleansed; category, latitude; float64, longitude; float64, property_type; category, room_type; category, accommodates; uint8, bathrooms; category, bathrooms_text; category, bedrooms; float64, beds; float64, amenities; object, price; category, minimum_nights; uint16, maximum_nights; uint32, minimum_minimum_nights; float64, maximum_minimum_nights; float64, minimum_maximum_nights; float64, maximum_maximum_nights; float64, minimum_nights_avg_ntm; float64, maximum_nights_avg_ntm; float64, calendar_updated; category, has_availability; category, availability_30; uint8, availability_60; uint8, availability_90; uint8, availability_365; uint16, calendar_last_scraped; datetime64[us, UTC], number_of_reviews; uint16, number_of_reviews_ltm; uint16, number_of_reviews_l30d; uint8, first_review; datetime64[us, UTC], last_review; datetime64[us, UTC], review_scores_rating; float64, review_scores_accuracy; float64, review_scores_cleanliness; float64, review_scores_checkin; float64, review_scores_communication; float64, review_scores_location; float64, review_scores_value; float64, license; category, instant_bookable; category, calculated_host_listings_count; uint8, calculated_host_listings_count_entire_homes; uint8, calculated_host_listings_count_private_rooms; uint8, calculated_host_listings_count_shared_rooms; uint8, reviews_per_month; float64",FALSE
Which are the 2 lowest values of host response rates above 0% ?,014_Airbnb,"id; int64, listing_url; category, scrape_id; int64, last_scraped; datetime64[us, UTC], source; category, name; object, description; object, neighborhood_overview; object, picture_url; category, host_id; uint32, host_url; category, host_name; category, host_since; datetime64[us, UTC], host_location; category, host_about; object, host_response_time; category, host_response_rate; category, host_acceptance_rate; category, host_is_superhost; category, host_thumbnail_url; category, host_picture_url; category, host_neighbourhood; category, host_listings_count; float64, host_total_listings_count; float64, host_verifications; object, host_has_profile_pic; category, host_identity_verified; category, neighbourhood; category, neighbourhood_cleansed; category, neighbourhood_group_cleansed; category, latitude; float64, longitude; float64, property_type; category, room_type; category, accommodates; uint8, bathrooms; category, bathrooms_text; category, bedrooms; float64, beds; float64, amenities; object, price; category, minimum_nights; uint16, maximum_nights; uint32, minimum_minimum_nights; float64, maximum_minimum_nights; float64, minimum_maximum_nights; float64, maximum_maximum_nights; float64, minimum_nights_avg_ntm; float64, maximum_nights_avg_ntm; float64, calendar_updated; category, has_availability; category, availability_30; uint8, availability_60; uint8, availability_90; uint8, availability_365; uint16, calendar_last_scraped; datetime64[us, UTC], number_of_reviews; uint16, number_of_reviews_ltm; uint16, number_of_reviews_l30d; uint8, first_review; datetime64[us, UTC], last_review; datetime64[us, UTC], review_scores_rating; float64, review_scores_accuracy; float64, review_scores_cleanliness; float64, review_scores_checkin; float64, review_scores_communication; float64, review_scores_location; float64, review_scores_value; float64, license; category, instant_bookable; category, calculated_host_listings_count; uint8, calculated_host_listings_count_entire_homes; uint8, calculated_host_listings_count_private_rooms; uint8, calculated_host_listings_count_shared_rooms; uint8, reviews_per_month; float64",Error: Cannot use method 'nsmallest' with dtype object
Which are the 2 lowest values of host response rates?,014_Airbnb,"id; int64, listing_url; category, scrape_id; int64, last_scraped; datetime64[us, UTC], source; category, name; object, description; object, neighborhood_overview; object, picture_url; category, host_id; uint32, host_url; category, host_name; category, host_since; datetime64[us, UTC], host_location; category, host_about; object, host_response_time; category, host_response_rate; category, host_acceptance_rate; category, host_is_superhost; category, host_thumbnail_url; category, host_picture_url; category, host_neighbourhood; category, host_listings_count; float64, host_total_listings_count; float64, host_verifications; object, host_has_profile_pic; category, host_identity_verified; category, neighbourhood; category, neighbourhood_cleansed; category, neighbourhood_group_cleansed; category, latitude; float64, longitude; float64, property_type; category, room_type; category, accommodates; uint8, bathrooms; category, bathrooms_text; category, bedrooms; float64, beds; float64, amenities; object, price; category, minimum_nights; uint16, maximum_nights; uint32, minimum_minimum_nights; float64, maximum_minimum_nights; float64, minimum_maximum_nights; float64, maximum_maximum_nights; float64, minimum_nights_avg_ntm; float64, maximum_nights_avg_ntm; float64, calendar_updated; category, has_availability; category, availability_30; uint8, availability_60; uint8, availability_90; uint8, availability_365; uint16, calendar_last_scraped; datetime64[us, UTC], number_of_reviews; uint16, number_of_reviews_ltm; uint16, number_of_reviews_l30d; uint8, first_review; datetime64[us, UTC], last_review; datetime64[us, UTC], review_scores_rating; float64, review_scores_accuracy; float64, review_scores_cleanliness; float64, review_scores_checkin; float64, review_scores_communication; float64, review_scores_location; float64, review_scores_value; float64, license; category, instant_bookable; category, calculated_host_listings_count; uint8, calculated_host_listings_count_entire_homes; uint8, calculated_host_listings_count_private_rooms; uint8, calculated_host_listings_count_shared_rooms; uint8, reviews_per_month; float64","Error: Column 'host_response_rate' has dtype object, cannot use method 'nsmallest' with this dtype"
What are the 4 highest values of host acceptance rates?,014_Airbnb,"id; int64, listing_url; category, scrape_id; int64, last_scraped; datetime64[us, UTC], source; category, name; object, description; object, neighborhood_overview; object, picture_url; category, host_id; uint32, host_url; category, host_name; category, host_since; datetime64[us, UTC], host_location; category, host_about; object, host_response_time; category, host_response_rate; category, host_acceptance_rate; category, host_is_superhost; category, host_thumbnail_url; category, host_picture_url; category, host_neighbourhood; category, host_listings_count; float64, host_total_listings_count; float64, host_verifications; object, host_has_profile_pic; category, host_identity_verified; category, neighbourhood; category, neighbourhood_cleansed; category, neighbourhood_group_cleansed; category, latitude; float64, longitude; float64, property_type; category, room_type; category, accommodates; uint8, bathrooms; category, bathrooms_text; category, bedrooms; float64, beds; float64, amenities; object, price; category, minimum_nights; uint16, maximum_nights; uint32, minimum_minimum_nights; float64, maximum_minimum_nights; float64, minimum_maximum_nights; float64, maximum_maximum_nights; float64, minimum_nights_avg_ntm; float64, maximum_nights_avg_ntm; float64, calendar_updated; category, has_availability; category, availability_30; uint8, availability_60; uint8, availability_90; uint8, availability_365; uint16, calendar_last_scraped; datetime64[us, UTC], number_of_reviews; uint16, number_of_reviews_ltm; uint16, number_of_reviews_l30d; uint8, first_review; datetime64[us, UTC], last_review; datetime64[us, UTC], review_scores_rating; float64, review_scores_accuracy; float64, review_scores_cleanliness; float64, review_scores_checkin; float64, review_scores_communication; float64, review_scores_location; float64, review_scores_value; float64, license; category, instant_bookable; category, calculated_host_listings_count; uint8, calculated_host_listings_count_entire_homes; uint8, calculated_host_listings_count_private_rooms; uint8, calculated_host_listings_count_shared_rooms; uint8, reviews_per_month; float64",Error: Cannot use method 'nlargest' with dtype object
Were there any employees hired in 2019?,018_Staff,"Left; category, Satisfaction Level; float64, Work Accident; category, Average Monthly Hours; uint16, Last Evaluation; float64, Years in the Company; uint8, salary; category, Department; category, Number of Projects; uint8, Promoted in the last 5 years?; category, Date Hired; datetime64[us, UTC]",Error: Can only use .dt accessor with datetimelike values
Which year had the highest number of employees hired?,018_Staff,"Left; category, Satisfaction Level; float64, Work Accident; category, Average Monthly Hours; uint16, Last Evaluation; float64, Years in the Company; uint8, salary; category, Department; category, Number of Projects; uint8, Promoted in the last 5 years?; category, Date Hired; datetime64[us, UTC]",Error: Can only use .dt accessor with datetimelike values
List the 3 departments with the most number of promotions in the last 5 years that have at least one promotion. ,018_Staff,"Left; category, Satisfaction Level; float64, Work Accident; category, Average Monthly Hours; uint16, Last Evaluation; float64, Years in the Company; uint8, salary; category, Department; category, Number of Projects; uint8, Promoted in the last 5 years?; category, Date Hired; datetime64[us, UTC]",FALSE
Identify the top 3 years with the highest employee hiring.,018_Staff,"Left; category, Satisfaction Level; float64, Work Accident; category, Average Monthly Hours; uint16, Last Evaluation; float64, Years in the Company; uint8, salary; category, Department; category, Number of Projects; uint8, Promoted in the last 5 years?; category, Date Hired; datetime64[us, UTC]",Error: Can only use .dt accessor with datetimelike values
List the bottom 5 average monthly hours among employees who were promoted in the last 5 years.,018_Staff,"Left; category, Satisfaction Level; float64, Work Accident; category, Average Monthly Hours; uint16, Last Evaluation; float64, Years in the Company; uint8, salary; category, Department; category, Number of Projects; uint8, Promoted in the last 5 years?; category, Date Hired; datetime64[us, UTC]",FALSE
Did any incident result in the total destruction of the aircraft?,019_Aircraft,"Incident_Date; category, Aircaft_Model; category, Aircaft_Registration; category, Aircaft_Operator; category, Aircaft_Nature; category, Incident_Category; category, Incident_Cause(es); category, Incident_Location; category, Aircaft_Damage_Type; category, Date; datetime64[us, UTC], Time; category, Arit; category, Aircaft_Engines; category, Onboard_Crew; category, Onboard_Passengers; category, Onboard_Total; category, Fatalities; uint16, Aircaft_First_Flight; category, Aircraft_Phase; category, Departure_Airport; category, Destination_Airport; category, Ground_Casualties; category, Collision_Casualties; category",FALSE
Has there been any instance where the ground casualties were non-zero?,019_Aircraft,"Incident_Date; category, Aircaft_Model; category, Aircaft_Registration; category, Aircaft_Operator; category, Aircaft_Nature; category, Incident_Category; category, Incident_Cause(es); category, Incident_Location; category, Aircaft_Damage_Type; category, Date; datetime64[us, UTC], Time; category, Arit; category, Aircaft_Engines; category, Onboard_Crew; category, Onboard_Passengers; category, Onboard_Total; category, Fatalities; uint16, Aircaft_First_Flight; category, Aircraft_Phase; category, Departure_Airport; category, Destination_Airport; category, Ground_Casualties; category, Collision_Casualties; category",Error: cannot convert float NaN to integer
What's the highest number of occupants recorded in an incident?,019_Aircraft,"Incident_Date; category, Aircaft_Model; category, Aircaft_Registration; category, Aircaft_Operator; category, Aircaft_Nature; category, Incident_Category; category, Incident_Cause(es); category, Incident_Location; category, Aircaft_Damage_Type; category, Date; datetime64[us, UTC], Time; category, Arit; category, Aircaft_Engines; category, Onboard_Crew; category, Onboard_Passengers; category, Onboard_Total; category, Fatalities; uint16, Aircaft_First_Flight; category, Aircraft_Phase; category, Departure_Airport; category, Destination_Airport; category, Ground_Casualties; category, Collision_Casualties; category",Error: could not convert string to float: 'Fatalities: 0 / Occupants: 7'
How many incidents occurred in January 2022?,019_Aircraft,"Incident_Date; category, Aircaft_Model; category, Aircaft_Registration; category, Aircaft_Operator; category, Aircaft_Nature; category, Incident_Category; category, Incident_Cause(es); category, Incident_Location; category, Aircaft_Damage_Type; category, Date; datetime64[us, UTC], Time; category, Arit; category, Aircaft_Engines; category, Onboard_Crew; category, Onboard_Passengers; category, Onboard_Total; category, Fatalities; uint16, Aircaft_First_Flight; category, Aircraft_Phase; category, Departure_Airport; category, Destination_Airport; category, Ground_Casualties; category, Collision_Casualties; category",Error: Can only use .dt accessor with datetimelike values
How many incidents resulted in non-zero fatalities?,019_Aircraft,"Incident_Date; category, Aircaft_Model; category, Aircaft_Registration; category, Aircaft_Operator; category, Aircaft_Nature; category, Incident_Category; category, Incident_Cause(es); category, Incident_Location; category, Aircaft_Damage_Type; category, Date; datetime64[us, UTC], Time; category, Arit; category, Aircaft_Engines; category, Onboard_Crew; category, Onboard_Passengers; category, Onboard_Total; category, Fatalities; uint16, Aircaft_First_Flight; category, Aircraft_Phase; category, Departure_Airport; category, Destination_Airport; category, Ground_Casualties; category, Collision_Casualties; category",FALSE
What was the cause of the incident that resulted in the most fatalities?,019_Aircraft,"Incident_Date; category, Aircaft_Model; category, Aircaft_Registration; category, Aircaft_Operator; category, Aircaft_Nature; category, Incident_Category; category, Incident_Cause(es); category, Incident_Location; category, Aircaft_Damage_Type; category, Date; datetime64[us, UTC], Time; category, Arit; category, Aircaft_Engines; category, Onboard_Crew; category, Onboard_Passengers; category, Onboard_Total; category, Fatalities; uint16, Aircaft_First_Flight; category, Aircraft_Phase; category, Departure_Airport; category, Destination_Airport; category, Ground_Casualties; category, Collision_Casualties; category",FALSE
