question,dataset_id,columns,query
What is the location of the incident with the highest number of onboard occupants?,019_Aircraft,"Incident_Date; category, Aircaft_Model; category, Aircaft_Registration; category, Aircaft_Operator; category, Aircaft_Nature; category, Incident_Category; category, Incident_Cause(es); category, Incident_Location; category, Aircaft_Damage_Type; category, Date; datetime64[us, UTC], Time; category, Arit; category, Aircaft_Engines; category, Onboard_Crew; category, Onboard_Passengers; category, Onboard_Total; category, Fatalities; uint16, Aircaft_First_Flight; category, Aircraft_Phase; category, Departure_Airport; category, Destination_Airport; category, Ground_Casualties; category, Collision_Casualties; category",Error: invalid literal for int() with base 10: 'Fatalities: 0 / Occupants: 7'
List the top 5 locations where the most incidents have occurred. If there are two or more with the same number order them alphabetically,019_Aircraft,"Incident_Date; category, Aircaft_Model; category, Aircaft_Registration; category, Aircaft_Operator; category, Aircaft_Nature; category, Incident_Category; category, Incident_Cause(es); category, Incident_Location; category, Aircaft_Damage_Type; category, Date; datetime64[us, UTC], Time; category, Arit; category, Aircaft_Engines; category, Onboard_Crew; category, Onboard_Passengers; category, Onboard_Total; category, Fatalities; uint16, Aircaft_First_Flight; category, Aircraft_Phase; category, Departure_Airport; category, Destination_Airport; category, Ground_Casualties; category, Collision_Casualties; category",FALSE
What are the 5 highest numbers of onboard passengers in incidents?,019_Aircraft,"Incident_Date; category, Aircaft_Model; category, Aircaft_Registration; category, Aircaft_Operator; category, Aircaft_Nature; category, Incident_Category; category, Incident_Cause(es); category, Incident_Location; category, Aircaft_Damage_Type; category, Date; datetime64[us, UTC], Time; category, Arit; category, Aircaft_Engines; category, Onboard_Crew; category, Onboard_Passengers; category, Onboard_Total; category, Fatalities; uint16, Aircaft_First_Flight; category, Aircraft_Phase; category, Departure_Airport; category, Destination_Airport; category, Ground_Casualties; category, Collision_Casualties; category",Error: Cannot use method 'nlargest' with dtype object
List the 3 highest numbers of onboard crew in incidents.,019_Aircraft,"Incident_Date; category, Aircaft_Model; category, Aircaft_Registration; category, Aircaft_Operator; category, Aircaft_Nature; category, Incident_Category; category, Incident_Cause(es); category, Incident_Location; category, Aircaft_Damage_Type; category, Date; datetime64[us, UTC], Time; category, Arit; category, Aircaft_Engines; category, Onboard_Crew; category, Onboard_Passengers; category, Onboard_Total; category, Fatalities; uint16, Aircaft_First_Flight; category, Aircraft_Phase; category, Departure_Airport; category, Destination_Airport; category, Ground_Casualties; category, Collision_Casualties; category",Error: Cannot use method 'nlargest' with dtype object
Identify the 4 highest numbers of total onboard occupants in incidents.,019_Aircraft,"Incident_Date; category, Aircaft_Model; category, Aircaft_Registration; category, Aircaft_Operator; category, Aircaft_Nature; category, Incident_Category; category, Incident_Cause(es); category, Incident_Location; category, Aircaft_Damage_Type; category, Date; datetime64[us, UTC], Time; category, Arit; category, Aircaft_Engines; category, Onboard_Crew; category, Onboard_Passengers; category, Onboard_Total; category, Fatalities; uint16, Aircaft_First_Flight; category, Aircraft_Phase; category, Departure_Airport; category, Destination_Airport; category, Ground_Casualties; category, Collision_Casualties; category",Error: Cannot use method 'nlargest' with dtype object
What are the 6 highest numbers of ground casualties in incidents?,019_Aircraft,"Incident_Date; category, Aircaft_Model; category, Aircaft_Registration; category, Aircaft_Operator; category, Aircaft_Nature; category, Incident_Category; category, Incident_Cause(es); category, Incident_Location; category, Aircaft_Damage_Type; category, Date; datetime64[us, UTC], Time; category, Arit; category, Aircaft_Engines; category, Onboard_Crew; category, Onboard_Passengers; category, Onboard_Total; category, Fatalities; uint16, Aircaft_First_Flight; category, Aircraft_Phase; category, Departure_Airport; category, Destination_Airport; category, Ground_Casualties; category, Collision_Casualties; category",Error: Cannot use method 'nlargest' with dtype object
Do all customers have phone service?,021_Telco,"customerID; category, gender; category, SeniorCitizen; uint8, Partner; category, Dependents; category, tenure; uint8, PhoneService; category, MultipleLines; category, InternetService; category, OnlineSecurity; category, OnlineBackup; category, DeviceProtection; category, TechSupport; category, StreamingTV; category, StreamingMovies; category, Contract; category, PaperlessBilling; category, PaymentMethod; category, MonthlyCharges; float64, TotalCharges; float64, Churn; category",FALSE
List the 4 most common property types.,022_Airbnbs,"listing_id; uint32, name; object, host_id; uint32, host_since; datetime64[us, UTC], host_location; category, host_response_time; category, host_response_rate; float64, host_acceptance_rate; float64, host_is_superhost; category, host_total_listings_count; float64, host_has_profile_pic; category, host_identity_verified; category, neighbourhood; category, district; category, city; category, latitude; float64, longitude; float64, property_type; category, room_type; category, accommodates; uint8, bedrooms; float64, amenities; object, price; uint16, minimum_nights; uint16, maximum_nights; uint32, review_scores_rating; float64, review_scores_accuracy; float64, review_scores_cleanliness; float64, review_scores_checkin; float64, review_scores_communication; float64, review_scores_location; float64, review_scores_value; float64, instant_bookable; category",FALSE
Were there days in the summer where the minimum temperature dropped below 10?,023_Climate,"fecha; datetime64[us, UTC], season; category, month_name; category, tmin; float64, tmax; float64, sol; float64, presMax; float64, presMin; float64, prec; float64, velmedia; float64, racha; float64, dir; float64, tmed; float64, horatmax; datetime64[us, UTC], horatmin; datetime64[us, UTC], horaPresMax; float64, horaPresMin; float64, horaracha; datetime64[us, UTC], weekday_name; category, dayofyear; uint16, quarter; uint8, year; uint16, altitud; uint16, nombre; category, provincia; category, indicativo; uint16",FALSE
"On average, what's the minimum temperature during winters?",023_Climate,"fecha; datetime64[us, UTC], season; category, month_name; category, tmin; float64, tmax; float64, sol; float64, presMax; float64, presMin; float64, prec; float64, velmedia; float64, racha; float64, dir; float64, tmed; float64, horatmax; datetime64[us, UTC], horatmin; datetime64[us, UTC], horaPresMax; float64, horaPresMin; float64, horaracha; datetime64[us, UTC], weekday_name; category, dayofyear; uint16, quarter; uint8, year; uint16, altitud; uint16, nombre; category, provincia; category, indicativo; uint16",FALSE
Are there any female respondents who belong to the ESTE NUTS1 region?,024_Salary,"clusters_2; category, RETRINOIN_xRZI; float64, CNO1; category, CNACE; category, ESTU; category, SEXO; category, ANOS2; category, NUTS1; category, ESTRATO2; category, CONTROL; category, MERCADO; category, REGULACION; category, TIPOPAIS; category, RESPONSA; category, ANOANTI; uint8, TIPOJOR; category, TIPOCON; category, RETRINOIN; float64, RETRINOIN_WwQk; float64, Quantiles_target; category, _gx_link_targets_; object, _gx_link_weights_; object, umap_cluster; category, x; float64, y; float64, RETRINOIN_ac1q; float64, RETRINOIN_QSbS; float64, RETRINOIN_stfU; float64, RETRINOIN_RxV1; float64",FALSE
"On average, what's the RETRINOIN value for male respondents?",024_Salary,"clusters_2; category, RETRINOIN_xRZI; float64, CNO1; category, CNACE; category, ESTU; category, SEXO; category, ANOS2; category, NUTS1; category, ESTRATO2; category, CONTROL; category, MERCADO; category, REGULACION; category, TIPOPAIS; category, RESPONSA; category, ANOANTI; uint8, TIPOJOR; category, TIPOCON; category, RETRINOIN; float64, RETRINOIN_WwQk; float64, Quantiles_target; category, _gx_link_targets_; object, _gx_link_weights_; object, umap_cluster; category, x; float64, y; float64, RETRINOIN_ac1q; float64, RETRINOIN_QSbS; float64, RETRINOIN_stfU; float64, RETRINOIN_RxV1; float64",FALSE
What is the lowest ranking value in the dataset?,025_Data,"URLs; category, Ranking; uint8, Keyword; category, Avg. monthly searches; uint8, Competition; category",FALSE
What are the top 3 URLs with the highest average monthly searches?,025_Data,"URLs; category, Ranking; uint8, Keyword; category, Avg. monthly searches; uint8, Competition; category",FALSE
List the bottom 2 competition levels of URLs with ranking better than 5.,025_Data,"URLs; category, Ranking; uint8, Keyword; category, Avg. monthly searches; uint8, Competition; category",Error: Cannot use method 'nsmallest' with dtype object
Which are the top 4 keywords associated with the URLs of lowest rankings?,025_Data,"URLs; category, Ranking; uint8, Keyword; category, Avg. monthly searches; uint8, Competition; category",FALSE
Enumerate the bottom 3 URLs with the highest rankings.,025_Data,"URLs; category, Ranking; uint8, Keyword; category, Avg. monthly searches; uint8, Competition; category",FALSE
What are the lowest 4 rankings associated with the keyword 'no code data science'?,025_Data,"URLs; category, Ranking; uint8, Keyword; category, Avg. monthly searches; uint8, Competition; category",FALSE
List the bottom 3 average monthly searches for URLs with medium competition.,025_Data,"URLs; category, Ranking; uint8, Keyword; category, Avg. monthly searches; uint8, Competition; category",FALSE
Provide the lowest 5 rankings of URLs with low competition (if any).,025_Data,"URLs; category, Ranking; uint8, Keyword; category, Avg. monthly searches; uint8, Competition; category",FALSE
Are there any individuals in the dataset who are above 60 years of age?,028_Predict,"Pregnancies; uint8, Glucose; uint8, BloodPressure; uint8, SkinThickness; uint8, Insulin; uint16, BMI; float64, DiabetesPedigreeFunction; float64, Age; uint8, Outcome; uint8",FALSE
Does anyone have a Diabetes Pedigree Function score above 2.5?,028_Predict,"Pregnancies; uint8, Glucose; uint8, BloodPressure; uint8, SkinThickness; uint8, Insulin; uint16, BMI; float64, DiabetesPedigreeFunction; float64, Age; uint8, Outcome; uint8",FALSE
How many individuals have an insulin level above 150?,028_Predict,"Pregnancies; uint8, Glucose; uint8, BloodPressure; uint8, SkinThickness; uint8, Insulin; uint16, BMI; float64, DiabetesPedigreeFunction; float64, Age; uint8, Outcome; uint8",FALSE
List the diabetes outcomes of the bottom 2 individuals with the lowest BMI.,028_Predict,"Pregnancies; uint8, Glucose; uint8, BloodPressure; uint8, SkinThickness; uint8, Insulin; uint16, BMI; float64, DiabetesPedigreeFunction; float64, Age; uint8, Outcome; uint8",FALSE
List the diabetes outcomes of the top 5 individuals with the highest insulin levels.,028_Predict,"Pregnancies; uint8, Glucose; uint8, BloodPressure; uint8, SkinThickness; uint8, Insulin; uint16, BMI; float64, DiabetesPedigreeFunction; float64, Age; uint8, Outcome; uint8",FALSE
List the diabetes outcomes of the bottom 4 individuals with the lowest blood pressure.,028_Predict,"Pregnancies; uint8, Glucose; uint8, BloodPressure; uint8, SkinThickness; uint8, Insulin; uint16, BMI; float64, DiabetesPedigreeFunction; float64, Age; uint8, Outcome; uint8",FALSE
What are the ages of the top 4 individuals with the highest number of pregnancies?,028_Predict,"Pregnancies; uint8, Glucose; uint8, BloodPressure; uint8, SkinThickness; uint8, Insulin; uint16, BMI; float64, DiabetesPedigreeFunction; float64, Age; uint8, Outcome; uint8",FALSE
List the BMI of the bottom 3 individuals with the lowest glucose levels.,028_Predict,"Pregnancies; uint8, Glucose; uint8, BloodPressure; uint8, SkinThickness; uint8, Insulin; uint16, BMI; float64, DiabetesPedigreeFunction; float64, Age; uint8, Outcome; uint8",FALSE
Enumerate the blood pressure levels of the top 5 individuals with the highest Diabetes Pedigree Function scores.,028_Predict,"Pregnancies; uint8, Glucose; uint8, BloodPressure; uint8, SkinThickness; uint8, Insulin; uint16, BMI; float64, DiabetesPedigreeFunction; float64, Age; uint8, Outcome; uint8",FALSE
Are there any articles that have the material type 'Op-Ed'?,029_NYTimes,"headline; object, date; datetime64[us, UTC], material_type; category, web_url; category, keywords; object",FALSE
How many unique material types are there in the dataset?,029_NYTimes,"headline; object, date; datetime64[us, UTC], material_type; category, web_url; category, keywords; object",FALSE
What is the longest length of a headline in the dataset?,029_NYTimes,"headline; object, date; datetime64[us, UTC], material_type; category, web_url; category, keywords; object",FALSE
How many articles were published on '2021-01-02'?,029_NYTimes,"headline; object, date; datetime64[us, UTC], material_type; category, web_url; category, keywords; object",FALSE
What is the highest number of keywords associated with a single article?,029_NYTimes,"headline; object, date; datetime64[us, UTC], material_type; category, web_url; category, keywords; object",FALSE
What is the material type of the article with the longest headline?,029_NYTimes,"headline; object, date; datetime64[us, UTC], material_type; category, web_url; category, keywords; object",FALSE
What is the material type of the article with the least number of keywords?,029_NYTimes,"headline; object, date; datetime64[us, UTC], material_type; category, web_url; category, keywords; object",FALSE
List the material types of the top 3 articles with the longest headlines.,029_NYTimes,"headline; object, date; datetime64[us, UTC], material_type; category, web_url; category, keywords; object","Error: Column 'headline' has dtype object, cannot use method 'nlargest' with this dtype"
List the material types of the bottom 4 articles with the least number of keywords.,029_NYTimes,"headline; object, date; datetime64[us, UTC], material_type; category, web_url; category, keywords; object","Error: Column 'keywords' has dtype object, cannot use method 'nsmallest' with this dtype"
What are the lengths of the headlines of the top 4 articles with the most number of keywords?,029_NYTimes,"headline; object, date; datetime64[us, UTC], material_type; category, web_url; category, keywords; object","Error: Column 'keywords' has dtype object, cannot use method 'nlargest' with this dtype"
Enumerate the lengths of the headlines of the top 5 articles with the longest headlines.,029_NYTimes,"headline; object, date; datetime64[us, UTC], material_type; category, web_url; category, keywords; object",FALSE
How many participants are from the United Kingdom?,030_Professionals,"Geographies; object, Labeled Clusters; category, General Segments; object, Select the title most similar to your current role (or most recent title if retired); category, In which country do you currently reside?; category, (Average) For how many years have you used machine learning methods?; float64, (Average) What is your current yearly compensation (approximate $USD)?_rx_K; float64, (Average) What is the size of the company where you are employed?; float64, (Average) For how many years have you been writing code and_or programming?; float64, Which of the following natural language processing (NLP) methods do you use on a regular basis?; object, Which of the following integrated development environments (IDE's) do you use on a regular basis?; object, What is your current yearly compensation (approximate $USD)?; category, Which of the following cloud computing platforms do you use on a regular basis?; object, Which of the following business intelligence tools do you hope to become more familiar with in the next 2 years?; object, Which of the following big data products (relational databases, data warehouses, data lakes, or similar) do you use on a regular basis?; object, Which of the following ML algorithms do you use on a regular basis?,Which of the following ML algorithms do you use on a regular basis?; object, For how many years have you been writing code and_or programming?; category, What is the size of the company where you are employed?; category, (Average) Approximately how much money have you (or your team) spent on machine; float64, (Average) What is your current yearly compensation (approximate $USD)?; float64, Which types of specialized hardware do you use on a regular basis?; object, (Average) Approximately how many individuals are responsible for data science wo; float64, Which of the following business intelligence tools do you use on a regular basis?; object, Do you use any automated machine learning tools (or partial AutoML tools) on a regular basis?; object, (Average) Approximately how many times have you used a TPU (tensor processing unit)?; float64, Do you use any of the following data storage products on a regular basis?; object, Approximately how many individuals are responsible for data science workloads at your place of business?; category, Of the cloud platforms that you are familiar with, which has the best developer experience (most enjoyable to use)?; category, On which platforms have you begun or completed data science courses?; object, Which categories of automated machine learning tools (or partial AutoML tools) do you hope to become more familiar with in the next 2 years?; object, Do you use any of the following managed machine learning products on a regular basis?; object, Who_what are your favorite media sources that report on data science topics?; object, In the next 2 years, do you hope to become more familiar with any of these specific cloud computing products?; object, Do you use any tools to help manage machine learning experiments?; object, Where do you publicly share your data analysis or machine learning applications?; object, Do you use any of the following cloud computing products on a regular basis?; object, In the next 2 years, do you hope to become more familiar with any of these tools for managing ML experiments?; object, What is your gender?; category, Which specific automated machine learning tools (or partial AutoML tools) do you hope to become more familiar with in the next 2 years?; object, Which categories of computer vision methods do you use on a regular basis?; object, For how many years have you used machine learning methods?; category, Which of the following machine learning frameworks do you use on a regular basis?,Which of the following machine learning frameworks do you use on a regular basis?; object, (Average) What is your age (years)?; float64, Which of the following big data products (relational database, data warehouse, data lake, or similar) do you use most often?; category, Which of the following business intelligence tools do you use most often?; category, What is the primary tool that you use at work or school to analyze data?; category, Does your current employer incorporate machine learning methods into their business?; category, Approximately how many times have you used a TPU (tensor processing unit)?; category, Which of the following hosted notebook products do you use on a regular basis?; object, What is the highest level of formal education that you have attained or plan to attain within the next 2 years?; category, In what industry is your current employer_contract (or your most recent employer if retired)?; category, Which of the following big data products (relational databases, data warehouses, data lakes, or similar) do you hope to become more familiar with in the next 2 years?; object, Time from Start to finish (seconds); uint32, ID; uint16, Approximately how much money have you (or your team) spent on machine learning and_or cloud computing services at home (or at work) in the past 5 years (approximate $USD)?; category, In the next 2 years, do you hope to become more familiar with any of these managed machine learning products?; object, Select any activities that make up an important part of your role at work; object, What data visualization libraries or tools do you use on a regular basis?; object, Which of the following automated machine learning tools (or partial AutoML tools) do you use on a regular basis?; object, What is your age (years)?; category, What programming language would you recommend an aspiring data scientist to learn first?; category, Which of the following cloud computing platforms do you hope to become more familiar with in the next 2 years?; object, What programming languages do you use on a regular basis?; object, What type of computing platform do you use most often for your data science projects?; category",FALSE
